6, Ice Zombie, Normal, Mook, Undead, Bestiary,79
6, Infernal Shadow, Normal, Spoiler, Demon, Eyes of the Stone Thief,334
6, Intellect Assassin, Normal, Spoiler, Aberration, Bestiary,118
6, Jackal Mage, Normal, Caster, Humanoid, Bestiary 2,122
6, Jotun Auroch, Huge, Mook, Beast, Bestiary,78
6, Large Black Dragon, Large, Wrecker, Dragon, 13th Age Core Rulebook,220
6, Large Bronze Dragon, Large, Wrecker, Dragon, 13 True Ways,185
6, Lich Flower, Double Strength, Blocker, Undead, 13 True Ways,194
6, Lokkris, Normal, Mook, Beast, Bestiary,61
6, Major Haunting, Normal, Mook, Undead, Bestiary 2,107
6, Manticore, Large, Archer, Beast, 13th Age Core Rulebook,238
6, Medium Red Dragon, Normal, Wrecker, Dragon, 13th Age Core Rulebook,220
6, Medium Silver Dragon, Normal, Spoiler, Dragon, 13 True Ways,185
6, Medusa Outlaw, Double Strength, Wrecker, Humanoid, 13th Age Core Rulebook,238
6, Ogre Mage Knight, Large, Wrecker, Giant, Bestiary,152
6, Orc Blood Sorcerer, Normal, Caster, Humanoid, Eyes of the Stone Thief,72
6, Orc Commander, Normal, Leader, Humanoid, Eyes of the Stone Thief,57
6, Orc Heavy Tusker, Normal, Troop, Humanoid, Eyes of the Stone Thief,85
6, Orc Tracker, Normal, Spoiler, Humanoid, Eyes of the Stone Thief,163
6, Parasitic Dybbuk, Double Strength, Spoiler, Demon, Bestiary,64
6, Phantom, Normal, Spoiler, Spirit, Bestiary 2,248
6, Pixie Knight, Normal, Troop, Humanoid, Bestiary 2,67
6, Poison Dandelion, Double Strength, Spoiler, Undead, 13 True Ways,195
6, Rakshasa Sybarite, Double Strength, Caster, Humanoid, Bestiary 2,224
6, Rathell Rat Zombies, Normal, Mook, Undead, Eyes of the Stone Thief,238
6, Remorhaz (Frost-Würm), Large, Troop, Beast, Bestiary,180
6, Remorhaz Frost-Wurm, Normal, Troop, Dragon, Bestiary,180
6, Rock Grub, Normal, Spoiler, Beast, Eyes of the Stone Thief,319
6, Rotroot Grubman, Normal, Mook, Demon, Eyes of the Stone Thief,238
6, Sahuagin Mutant, Double Strength, Wrecker, Humanoid, Bestiary,189
6, Sahuagin Sorcerer, Normal, Caster, Humanoid, Eyes of the Stone Thief,108
6, Sahuagin Warrior, Normal, Wrecker, Humanoid, Eyes of the Stone Thief,107
6, Shadow Mongoose Subverter Of Fate, Normal, Spoiler, Spirit, Bestiary 2,240
6, Shipwrecked Sailor, Normal, Mook, Humanoid, Eyes of the Stone Thief,118
6, Skeletal Shamblers, Normal, Mook, Undead, Eyes of the Stone Thief,127
6, Skywurm, Normal, Troop, Beast, Eyes of the Stone Thief,329
6, Slaughterspawn, Normal, Mook, Demon, Eyes of the Stone Thief,119
6, Sparkscale Naga, Large, Leader, Beast, Bestiary,144
6, Specter, Double Strength, Wrecker, Undead, 13 True Ways,201
6, Spell Golem Warder, Normal, Blocker, Construct, Bestiary 2,252
6, Spider Mount, Normal, Troop, Beast, Bestiary,60
6, Spriggan, Normal, Blocker, Humanoid, Bestiary 2,68
6, Star-Mask Cult Leader, Double Strength, Leader, Aberration, Bestiary 2,260
6, Star-Mask Cult Puppet, Normal, Troop, Aberration, Bestiary 2,260
6, Stone Imp Reject, Normal, Mook, Construct, Eyes of the Stone Thief,47
6, Taranar Avalanche, Huge, Wrecker, Elemental, Bestiary 2,284
6, Terribly Hungry Star, Normal, Wrecker, Aberration, Eyes of the Stone Thief,51
6, The Miller, Double Strength, Spoiler, Undead, Eyes of the Stone Thief,283
6, Thunder Sorcerer, Normal, Caster, Humanoid, Eyes of the Stone Thief,336
6, Trog Shaman, Normal, Leader, Humanoid, Bestiary 2,276
6, Undead Librarian, Normal, Wrecker, Undead, Eyes of the Stone Thief,93
6, Vampire Spawn, Normal, Spoiler, Undead, 13th Age Core Rulebook,249
6, Vrock (Vulture Demon), Normal, Spoiler, Demon, 13th Age Core Rulebook,211
6, Waterhorse, Double Strength, Spoiler, Humanoid, Bestiary 2,199
6, Weretiger, Large, Troop, Beast, 13 True Ways,206
6, Wild Oread, Double Strength, Spoiler, Elemental, Bestiary 2,207
6, Winter Beast, Normal, Troop, Undead, Eyes of the Stone Thief,241
6, Wyrmtwine Worms, Normal, Mook, Dragon, Eyes of the Stone Thief,238
7, Animated Halberd, Normal, Mook, Construct, Eyes of the Stone Thief,231
7, Barbed Vines, Normal, Mook, Plant, Bestiary 2,25
7, Bergship Raider, Large, Spoiler, Giant, Bestiary,77
7, Big Air Elemental, Normal, Wrecker, Elemental, 13 True Ways,191
7, Big Earth Elemental, Normal, Blocker, Elemental, 13 True Ways,191
7, Big Fire Elemental, Normal, Wrecker, Elemental, 13 True Ways,191
7, Big Flux Elemental, Normal, Troop, Elemental, Bestiary 2,78
7, Big Water Elemental, Normal, Blocker, Elemental, 13 True Ways,191
7, Black Serpent Assassin, Normal, Spoiler, Humanoid, Eyes of the Stone Thief,212
7, Bonded Arcane Archer, Triple Strength, Archer, Construct, Bestiary 2,15
7, Bonded Hexknight, Triple Strength, Troop, Construct, Bestiary 2,15
7, Bronze Errant, Triple Strength, Blocker, Construct, Bestiary 2,114
7, Bronze Golem, Large, Blocker, Construct, Bestiary,100
7, Cave Mouth, Normal, Blocker, Aberration, Eyes of the Stone Thief,248
7, Cavernwight Spawn, Normal, Mook, Construct, Eyes of the Stone Thief,286
7, Cloud Giant Mage, Huge, Caster, Giant, 13 True Ways,165
7, Cloud Giant Magician, Huge, Caster, Giant, 13 True Ways,165
7, Cloud Giant Thane, Huge, Wrecker, Giant, 13 True Ways,165
7, Cloud Giant Warrior, Huge, Troop, Giant, 13 True Ways,165
7, Crustycap, Normal, Wrecker, Humanoid, Bestiary,176
7, Cult Enforcer, Normal, Blocker, Humanoid, Eyes of the Stone Thief,253
7, Cult Sorcerer, Normal, Caster, Humanoid, Eyes of the Stone Thief,261
7, Death Shade, Normal, Mook, Undead, Bestiary 2,230
7, Death-Bound Shade, Normal, Mook, Undead, Eyes of the Stone Thief,64
7, Derro Master-Sage, Normal, Caster, Humanoid, Eyes of the Stone Thief,91
7, Devil Of The Fangs, Huge, Spoiler, Devil, 13 True Ways,180
7, Dire Owlbear, Normal, Wrecker, Beast, Eyes of the Stone Thief,178
7, Dorfin The Thief, Normal, Spoiler, Humanoid, Eyes of the Stone Thief,216
7, Dreams Of The Devourer, Normal, Spoiler, Aberration, Eyes of the Stone Thief,266
7, Drow Darkbolt, Normal, Archer, Humanoid, Bestiary,59
7, Drunken Wizard, Normal, Caster, Humanoid, Eyes of the Stone Thief,235
7, Dungeon Marauder, Normal, Caster, Humanoid, Eyes of the Stone Thief,268
7, Dwarven Warrior, Normal, Troop, Humanoid, Eyes of the Stone Thief,235
7, Ebon Gauntlet Inquisitor, Double Strength, Leader, Humanoid, Bestiary 2,41
7, Elf Spectral Warrior, Normal, Troop, Undead, Eyes of the Stone Thief,143
7, Ethereal Dybbuk, Double Strength, Wrecker, Demon, Bestiary,65
7, Fallen Lammasu, Large, Wrecker, Beast, Bestiary,131
7, Fang Devil, Huge, Spoiler, Devil, 13 True Ways,180
7, Faun Outlaw, Normal, Troop, Humanoid, Bestiary 2,60
7, Faun Ranger, Normal, Archer, Humanoid, Bestiary 2,60
7, Feast-Goers, Normal, Mook, Humanoid, Eyes of the Stone Thief,235
7, Fell Dryad, Normal, Spoiler, Humanoid, Eyes of the Stone Thief,335
7, Fercrag, Double Strength, Wrecker, Humanoid, Eyes of the Stone Thief,322
7, Fire Giant Holy Warrior, Large, Troop, Giant, Bestiary 2,73
7, Fire Giant Smith, Large, Caster, Giant, Bestiary 2,74
7, Fomorian Top-Cannibal, Large, Wrecker, Giant, Bestiary 2,84
7, Frogspawn Old-One, Elite, Leader, Humanoid, Bestiary 2,100
7, Frost Giant, Large, Spoiler, Giant, 13th Age Core Rulebook,226
7, Gelatinous Dodecahedron, Huge, Blocker, Ooze, Bestiary,90
7, Gnoll Death Priest Acolyte, Normal, Mook, Humanoid, Eyes of the Stone Thief,225
7, Gnoll Fiendfletch, Normal, Archer, Humanoid, 13 True Ways,196
7, Gnoll Shredder, Normal, Blocker, Humanoid, 13 True Ways,196
7, Greater Ebon Gauntlet Sword, Normal, Troop, Humanoid, Bestiary 2,42
7, Harpy Diva, Double Strength, Spoiler, Humanoid, Eyes of the Stone Thief,61
7, Hellclam, Normal, Blocker, Demon, Eyes of the Stone Thief,119
7, Hellstone Gargoyle, Normal, Wrecker, Construct, Bestiary 2,139
7, Hezrou (Toad Demon), Large, Troop, Demon, 13th Age Core Rulebook,212
7, Hooded Devil, Normal, Troop, Devil, 13 True Ways,174
7, Ice Sorceress, Large, Caster, Giant, Bestiary,77
7, Jackal Priest, Elite, Wrecker, Humanoid, Bestiary 2,123
7, Kohwa Enforcer, Large, Troop, Beast, Bestiary 2,162
7, Koruku Symbiont, Normal, Spoiler, Humanoid, Bestiary 2,165
7, Lammasu Warrior, Large, Troop, Beast, Bestiary,131
7, Large Green Dragon, Large, Spoiler, Dragon, 13th Age Core Rulebook,220
7, Lesser Abomination, Normal, Mook, Aberration, Eyes of the Stone Thief,148
7, Lorgo, Normal, Wrecker, Giant, Eyes of the Stone Thief,117
7, Manafang Naga, Large, Leader, Beast, Bestiary,144
7, Masked Demon, Normal, Spoiler, Demon, Eyes of the Stone Thief,334
7, Medium Gold Dragon, Normal, Caster, Dragon, 13 True Ways,186
7, Melusine, Double Strength, Spoiler, Humanoid, Bestiary 2,200
7, Moon Dragon (White), Huge, Troop, Dragon, Bestiary,220
7, Necromagus, Normal, Caster, Undead, Eyes of the Stone Thief, 126/Td>
7, Odma The Seer, Double Strength, Caster, Humanoid, Eyes of the Stone Thief,322
7, Ogre Mage, Large, Caster, Giant, 13th Age Core Rulebook,240
7, Orc Rager, Normal, Mook, Humanoid, 13th Age Core Rulebook,242
7, Ogre Stalker, Large, Wrecker, Giant, Eyes of the Stone Thief,164
7, Orc Sniper, Normal, Archer, Humanoid, Eyes of the Stone Thief,288
7, Pale Lizard, Normal, Spoiler, Beast, Eyes of the Stone Thief,95
7, Phase Spider, Large, Wrecker, Beast, 13th Age Core Rulebook,244
7, Plague Zombies Ghost, Normal, Mook, Undead, Eyes of the Stone Thief,233
7, Princess Shatter, Normal, Leader, Humanoid, Eyes of the Stone Thief,216
7, Raging Wyvern, Normal, Wrecker, Beast, Eyes of the Stone Thief,286
7, Reaver, Double Strength, Spoiler, Humanoid, Bestiary 2,230
7, Redscale Fiery Vanquisher, Normal, Wrecker, Humanoid, Bestiary 2,176
7, River-Spirit, Double Strength, Spoiler, Humanoid, Bestiary 2,68
7, Sahuagin Priest, Normal, Caster, Humanoid, Eyes of the Stone Thief,108
7, Screaming Hoardling, Normal, Troop, Undead, Bestiary 2,114
7, Scrimshawed Skelepede, Normal, Wrecker, Undead, Eyes of the Stone Thief,66
7, Seven-Headed Hydra, Huge, Wrecker, Beast, 13th Age Core Rulebook,236
7, Sister Selra, Normal, Caster, Humanoid, Eyes of the Stone Thief,117
7, Snake Swarm, Normal, Mook, Beast, Eyes of the Stone Thief,213
7, Star-Mask Brainburster, Normal, Spoiler, Aberration, Bestiary 2,260
7, Star-Mask Brute, Large, Wrecker, Aberration, Bestiary 2,261
7, Summoned Ghoul, Normal, Mook, Humanoid, Bestiary 2,123
7, Swordapus, Normal, Wrecker, Beast, Eyes of the Stone Thief,105
7, Temple Lion, Large, Wrecker, Construct, Bestiary 2,130
7, Tempter, Double Strength, Blocker, Undead, Bestiary 2,249
7, The Architect, Double Strength, Caster, Construct, Eyes of the Stone Thief,85
7, The Flesh Tailor, Double Strength, Caster, Undead, Eyes of the Stone Thief,130
7, The Gravekeeper, Double Strength, Caster, Construct, Eyes of the Stone Thief,136
7, Theobald The Traitor, Normal, Wrecker, Construct, Eyes of the Stone Thief,136
7, Tomb Lord, Normal, Spoiler, Undead, Eyes of the Stone Thief,126
7, Tough Frenzy Demon, Normal, Wrecker, Demon, Eyes of the Stone Thief,119
7, Trog Chieftain, Normal, Leader, Humanoid, Bestiary 2,276
7, Twisted Soul, Double Strength, Spoiler, Undead, Bestiary 2,107
7, Tyrant Lizard, Large, Wrecker, Beast, Bestiary 2,272
7, Umluppuk, Huge, Spoiler, Aberration, Bestiary,69
7, Void Dragon (Black), Huge, Caster, Dragon, Bestiary,18
7, Volcano Dragon (Red), Large, Wrecker, Dragon, Bestiary,168
7, Wandering Hubris Devil, Huge, Wrecker, Devil, Bestiary 2,149
7, Wild Nereid, Double Strength, Spoiler, Elemental, Bestiary 2,208
8,"Carid, Reseeded", Triple Strength, Troop, Plant, 13 True Ways,254
8, Adult Remorhaz, Large, Wrecker, Beast, Bestiary,180
8, Akkad Demon, Normal, Troop, Demon, Eyes of the Stone Thief,231
8, Archivult King, Normal, Wrecker, Beast, Eyes of the Stone Thief,189
8, Armored Hill Giant, Normal, Troop, Giant, Eyes of the Stone Thief,158
8, Armored War Troll, Normal, Wrecker, Giant, Eyes of the Stone Thief,166
8, Artalin Shade, Normal, Troop, Undead, Eyes of the Stone Thief,233
8, Baleful Cyclops, Normal, Troop, Giant, Eyes of the Stone Thief,267
8, Black Skull, Normal, Caster, Undead, Bestiary,110
8, Blazing Shade, Normal, Spoiler, Demon, Eyes of the Stone Thief,111
8, Bloodweeds, Normal, Mook, Plant, Eyes of the Stone Thief,153
8, Bonded Prophet, Triple Strength, Leader, Construct, Bestiary 2,16
8, Bonded Warlock, Triple Strength, Caster, Construct, Bestiary 2,16
8, Briar Elf Stalker, Normal, Archer, Humanoid, Bestiary 2,27
8, Cambion Hellblade, Normal, Wrecker, Demon, Bestiary,32
8, Captain Bluescale, Normal, Leader, Humanoid, Eyes of the Stone Thief,117
8, Cats Of Rathell, Normal, Wrecker, Beast, Eyes of the Stone Thief,238
8, Chaos Hydra, Huge, Wrecker, Beast, Bestiary 2,153
8, Couatl, Large, Spoiler, Beast, Bestiary,52
8, Crowned Gargoyle, Normal, Wrecker, Construct, Eyes of the Stone Thief,319
8, Cult Acolyte, Normal, Mook, Humanoid, Eyes of the Stone Thief,253
8, Cult Assassin, Normal, Wrecker, Humanoid, Eyes of the Stone Thief,263
8, Cult Mummy, Double Strength, Wrecker, Undead, Eyes of the Stone Thief,248
8, Death Knight, Double Strength, Wrecker, Undead, Bestiary 2,249
8, Demonic Hunting Pig, Normal, Mook, Beast, Eyes of the Stone Thief,164
8, Drow Cave Stalker, Normal, Blocker, Humanoid, Eyes of the Stone Thief,141
8, Dwarf God Statue, Normal, Blocker, Construct, Eyes of the Stone Thief,55
8, Dwarf Vampire Priest, Normal, Caster, Undead, Eyes of the Stone Thief,217
8, Elder Swaysong Naga, Normal, Leader, Beast, Bestiary,144
8, Elfshades, Normal, Mook, Undead, Eyes of the Stone Thief,172
8, Fat Troll, Normal, Troop, Giant, Eyes of the Stone Thief,156
8, Fire Giant Priest-General, Elite Large, Leader, Giant, Bestiary 2,74
8, Flowstone Dragon, Normal, Blocker, Dragon, Eyes of the Stone Thief,263
8, Frost Giant Adventurer, Large, Spoiler, Giant, Bestiary,78
8, Fury Devil (Erinyes), Normal, Wrecker, Devil, 13 True Ways,175
8, Gatekeeper Mage, Normal, Caster, Humanoid, Eyes of the Stone Thief,286
8, Giant Jungle Stewpot Plant, Normal, Spoiler, Plant, Eyes of the Stone Thief,152
8, Giant Praying Mantis, Large, Blocker, Beast, 13 True Ways,161
8, Glabrezou (Pincer Demon), Large, Caster, Demon, 13th Age Core Rulebook,212
8, Godtick, Normal, Leader, Demon, Eyes of the Stone Thief,183
8, Golden Eye Necromancer, Triple Strength, Caster, Undead, Bestiary 2,249
8, Golden Serpent Warrior, Normal, Troop, Humanoid, Eyes of the Stone Thief,212
8, Great Minotaur, Triple Strength, Wrecker, Beast, Eyes of the Stone Thief,63
8, Great Xorn, Elite, Spoiler, Elemental, Bestiary 2,290
8, Greater Abomination, Normal, Wrecker, Aberration, Eyes of the Stone Thief,148
8, Greyface, Double Strength, Leader, Humanoid, Eyes of the Stone Thief,179
8, Grim Guardians, Normal, Leader, Undead, Eyes of the Stone Thief,126
8, Grimtusk, Double Strength, Leader, Beast, Eyes of the Stone Thief,177
8, Half-Orc Commander, Normal, Leader, Humanoid, 13th Age Core Rulebook,233
8, Horned Salamander, Huge, Troop, Elemental, Bestiary 2,234
8, Iconic Chimera, Large, Wrecker, Beast, Bestiary,42
8, Koruku Landkiller, Huge, Leader, Beast, Bestiary 2,166
8, Koruku Servitor, Normal, Mook, Beast, Bestiary 2,166
8, Lammasu Wizard, Large, Spoiler, Beast, Bestiary,132
8, Large Blue Dragon, Large, Caster, Dragon, 13th Age Core Rulebook,221
8, Laughing Demon, Normal, Troop, Beast, Bestiary 2,181
8, Lesser Archivult, Normal, Mook, Beast, Eyes of the Stone Thief,189
8, Lesser Stone Hand, Normal, Mook, Construct, Eyes of the Stone Thief,112
8, Lich Count, Double Strength, Spoiler, Undead, Bestiary,135
8, Lord Sunhammer, Normal, Wrecker, Humanoid, Eyes of the Stone Thief,235
8, Manymouth, Normal, Wrecker, Aberration, Eyes of the Stone Thief,242
9, Marble Golem, Large, Troop, Construct, Bestiary,101
8, Midhogg’S Brood, Normal, Mook, Dragon, Eyes of the Stone Thief,217
8, Mummy, Double Strength, Wrecker, Undead, 13 True Ways,197
8, Nascent Dungeon, Normal, Spoiler, Aberration, Eyes of the Stone Thief,238
8, Nix, Normal, Spoiler, Humanoid, Bestiary 2,200
8, Ogre Lightning Mage, Large, Caster, Giant, Bestiary,152
8, Orc Heavy Guard, Normal, Blocker, Humanoid, Eyes of the Stone Thief,288
8, Orc Veteran, Normal, Troop, Humanoid, Eyes of the Stone Thief,163
8, Orc War Spirit, Normal, Mook, Undead, Eyes of the Stone Thief,185
8, Orcish Piker, Normal, Troop, Humanoid, Eyes of the Stone Thief,192
8, Parasitic Lightning Beetle, Normal, Mook, Beast, Bestiary,164
8, Pet Thundercloud, Normal, Spoiler, Aberration, Eyes of the Stone Thief,329
8, Possessor Demon, Normal, Spoiler, Demon, Eyes of the Stone Thief,178
8, Prayer Wheel, Normal, Caster, Construct, Eyes of the Stone Thief,199
8, Purple Dragon (Champion), Huge, Caster, Dragon, Bestiary 2,186
8, Purple Larvae, Normal, Mook, Beast, Bestiary,165
8, Purple Worm, Huge, Wrecker, Beast, Bestiary,164
8, Rakshasa Delver, Double Strength, Caster, Humanoid, Bestiary 2,225
8, Remorhaz (Adult), Large, Wrecker, Beast, Bestiary,180
8, Ripper Clockworker, Normal, Mook, Construct, Eyes of the Stone Thief,199
8, Rootrot Mossmen, Normal, Caster, Plant, Eyes of the Stone Thief,238
8, Rotten Twigling, Normal, Mook, Plant, Eyes of the Stone Thief,144
8, Sahuagin Madfish, Normal, Wrecker, Humanoid, Eyes of the Stone Thief,111
8, Shadow Dragon, Large, Caster, Dragon, Bestiary,193
8, Shadow Mongoose Thief Of Fate, Normal, Spoiler, Spirit, Bestiary 2,241
8, Shadow Thief, Normal, Mook, Dragon, Bestiary,193
8, Shrieking Bowmen, Normal, Archer, Humanoid, Eyes of the Stone Thief,242
8, Shrieking Strangler, Normal, Mook, Humanoid, Eyes of the Stone Thief,249
8, Sourblood, Normal, Leader, Humanoid, Eyes of the Stone Thief,192
8, Spawn, Normal, Mook, Aberration, Eyes of the Stone Thief,324
8, Spellshadow, Normal, Mook, Aberration, Eyes of the Stone Thief,251
8, Stalwart Clockworker, Normal, Blocker, Construct, Eyes of the Stone Thief,198
8, Stone Brute, Normal, Troop, Construct, Eyes of the Stone Thief,172
8, Stone Giant, Large, Troop, Giant, 13th Age Core Rulebook,226
8, Stone Golem, Large, Blocker, Construct, 13th Age Core Rulebook,232
8, Stone Hands, Normal, Wrecker, Construct, Eyes of the Stone Thief,112
8, Stoneborn Orc, Normal, Mook, Humanoid, Eyes of the Stone Thief,165
8, Sublime Orc, Normal, Spoiler, Aberration, Eyes of the Stone Thief,268
8, Sunder Wraith, Normal, Blocker, Undead, Bestiary 2,267
8, Taranar Great Stone, Huge, Wrecker, Elemental, Bestiary 2,284
8, Taranar Warrior, Large, Spoiler, Elemental, Bestiary 2,284
8, The Celestial Guardian, Double Strength, Wrecker, Construct, Eyes of the Stone Thief,192
8, The Ghost Of Perido, Triple Strength, Caster, Undead, Eyes of the Stone Thief,170
8, The Witch Of Marblehall, Double Strength, Caster, Humanoid, Eyes of the Stone Thief,240
8, Thing In The Cave, Triple Strength, Wrecker, Aberration, Eyes of the Stone Thief,324
8, Thorn Creepers, Normal, Archer, Plant, Eyes of the Stone Thief,152
8, Titanic Abomination, Normal, Wrecker, Aberration, Eyes of the Stone Thief,149
8, Trog Underling, Normal, Mook, Humanoid, 13th Age Core Rulebook,247
8, Unseen Wardens, Normal, Spoiler, Demon, Eyes of the Stone Thief,255
8, Void Phoenix, Large, Spoiler, Elemental, Bestiary 2,217
8, Whitescale Blighter, Normal, Leader, Humanoid, Bestiary 2,176
8, Wyrmtwine Dragonlings, Normal, Wrecker, Dragon, Eyes of the Stone Thief,239
9,"Jac, Cult Agent", Normal, Spoiler, Humanoid, Eyes of the Stone Thief,193
9,"Pheig, Hag Grandmother", Double Strength, Spoiler, Humanoid, Eyes of the Stone Thief,156
9, Arkad Demon Sergeant, Normal, Leader, Demon, Eyes of the Stone Thief,231
9, Black Pudding, Huge, Wrecker, Ooze, 13th Age Core Rulebook,241
9, Blade Thrall, Double Strength, Spoiler, Humanoid, Eyes of the Stone Thief,201
9, Blind Uthe, Normal, Caster, Humanoid, Eyes of the Stone Thief,185
9, Bone Devil (Osyluth), Large, Troop, Devil, 13 True Ways,176
9, Briar Elf Warrior, Normal, Troop, Humanoid, Bestiary 2,28
9, Briar Tree, Normal, Leader, Plant, Bestiary 2,25
9, Chimera, Large, Wrecker, Beast, 13th Age Core Rulebook,209
9, Chryaxas The Cripple, Normal, Spoiler, Dragon, Eyes of the Stone Thief,196
9, Cult Champion, Double Strength, Wrecker, Humanoid, Eyes of the Stone Thief,253
9, Cult High Priest, Normal, Leader, Humanoid, Eyes of the Stone Thief,253
9, Deep Bulette, Huge, Wrecker, Beast, Bestiary,28
9, Despoiler Mage, Normal, Caster, Demon, 13th Age Core Rulebook,213
9, Djinn, Large, Spoiler, Giant, Bestiary,93
9, Dread Specter, Triple Strength, Wrecker, Undead, 13 True Ways,201
9, Drow Cavalry, Double Strength, Wrecker, Humanoid, Bestiary,59
9, Eidolon In Guardian Form, Triple Strength, Troop, Spirit, Bestiary 2,48
9, Elder Sparkscale Naga, Normal, Leader, Beast, Bestiary,145
9, Elder Wendigo, Huge, Spoiler, Demon, Bestiary,212
9, Elf Banshee, Normal, Caster, Undead, Eyes of the Stone Thief,144
9, Elite Orc Guard, Normal, Blocker, Humanoid, Eyes of the Stone Thief,166
9, Empyrean Dragon (Black), Huge, Spoiler, Dragon, Bestiary,18
9, Epic Air Elemental, Normal, Wrecker, Elemental, 13 True Ways,192
9, Epic Earth Elemental, Normal, Blocker, Elemental, 13 True Ways,192
9, Epic Fire Elemental, Normal, Wrecker, Elemental, 13 True Ways,193
9, Epic Haunting, Normal, Mook, Undead, Bestiary 2,108
9, Epic Water Elemental, Normal, Blocker, Elemental, 13 True Ways,193
9, Fangrot, Double Strength, Leader, Humanoid, Eyes of the Stone Thief,187
9, Fire Giant Pyromancer, Normal, Caster, Giant, Eyes of the Stone Thief,200
9, Fire Giant Warlord, Large, Leader, Giant, 13th Age Core Rulebook,227
9, Giant Vrock (Vulture Demon), Large, Spoiler, Demon, 13th Age Core Rulebook,214
9, Giant Zombie, Large, Mook, Undead, 13th Age Core Rulebook,251
9, Goblin Elite Scout, Normal, Mook, Humanoid, Eyes of the Stone Thief,300
9, Great Hubris Devil, Huge, Wrecker, Devil, Bestiary 2,149
9, Greater Flux Elemental, Normal, Troop, Undead, Bestiary 2,78
9, Greenscale Spineback, Normal, Spoiler, Humanoid, Bestiary 2,177
9, Guardian Statues, Normal, Troop, Construct, Eyes of the Stone Thief,208
9, Headless Zombie, Normal, Troop, Undead, 13 True Ways,207
9, Hoard Spirit, Normal, Mook, Construct, Bestiary,169
9, Hoardsong Dragon (Red), Large, Spoiler, Dragon, Bestiary,169
9, Hooked Demon, Normal, Mook, Demon, 13th Age Core Rulebook,213
9, Huge Black Dragon, Huge, Wrecker, Dragon, 13th Age Core Rulebook,221
9, Huge Bronze Dragon, Huge, Wrecker, Dragon, 13 True Ways,186
9, Ice Ape, Normal, Wrecker, Giant, Eyes of the Stone Thief,201
9, Jackal High Mage, Normal, Caster, Humanoid, Bestiary 2,123
9, Koruk The Invincible, Double Strength, Leader, Humanoid, Eyes of the Stone Thief,322
9, Lammasu Priest, Large, Caster, Beast, Bestiary,132
9, Large Copper Dragon, Large, Spoiler, Dragon, 13 True Ways,186
9, Master Blood Sorcerer, Normal, Caster, Humanoid, Eyes of the Stone Thief,300
9, Midhogg, Normal, Wrecker, Dragon, Eyes of the Stone Thief,217
9, Moon Serpent Sorcerer, Normal, Leader, Humanoid, Eyes of the Stone Thief,212
9, Nioba Shieldspinner, Double Strength, Leader, Humanoid, Eyes of the Stone Thief,142
9, Ogre Minion, Large, Mook, Giant, Bestiary,150
9, Orc Fanatics, Normal, Mook, Humanoid, Eyes of the Stone Thief,300
9, Pilgrim Shade, Normal, Mook, Undead, Eyes of the Stone Thief,207
9, Prismatic Ogre Mage, Large, Caster, Giant, Bestiary,153
9, Rakshasa Mastermind, Double Strength, Caster, Humanoid, Bestiary 2,225
9, Sahuagin King, Normal, Leader, Humanoid, Eyes of the Stone Thief,109
9, Secret Master, Double Strength, Caster, Humanoid, Eyes of the Stone Thief,254
9, Shade Of Benedict Artalin, Normal, Leader, Undead, Eyes of the Stone Thief,233
9, Shambling Undead Adventurer, Normal, Mook, Undead, Eyes of the Stone Thief,274
9, Skull Of The Beast, Large, Wrecker, Undead, Bestiary,110
9, Snakescale Horror, Normal, Troop, Humanoid, Eyes of the Stone Thief,203
9, Soul Flenser, Normal, Spoiler, Aberration, 13 True Ways,199
9, Spell Golem Mage Hunter, Large, Spoiler, Construct, Bestiary 2,253
9, Stone Brute Mooks, Normal, Mook, Construct, Eyes of the Stone Thief,277
9, Stone Sentinels, Normal, Blocker, Construct, Eyes of the Stone Thief,276
9, Thaumaunt, Normal, Caster, Aberration, Eyes of the Stone Thief,250
9, The Alabaster Sentinel, Normal, Troop, Construct, Eyes of the Stone Thief,206
9, The Curator, Double Strength, Caster, Construct, Eyes of the Stone Thief,215
9, The False Thief, Double Strength, Wrecker, Construct, Eyes of the Stone Thief,276
9, The Flensed, Normal, Mook, Aberration, 13 True Ways,200
9, The Provost, Triple Strength, Leader, Humanoid, Eyes of the Stone Thief,101
9, The Sorcerer, Normal, Caster, Humanoid, Eyes of the Stone Thief,159
9, Undead Cleric, Normal, Blocker, Undead, Eyes of the Stone Thief,274
9, Undead Fighter, Normal, Troop, Undead, Eyes of the Stone Thief,274
9, Undead Rogye, Normal, Wrecker, Undead, Eyes of the Stone Thief,274
9, Undead Wizard, Normal, Caster, Undead, Eyes of the Stone Thief,274
9, Vizier, Double Strength, Caster, Construct, Eyes of the Stone Thief,188
9, Wraith Bat, Normal, Mook, Undead, Bestiary,15
10, Azanth Choketongue, Normal, Caster, Humanoid, Eyes of the Stone Thief,294
10, Barbed Devil (Hamatula), Normal, Caster, Devil, 13 True Ways,176
10, Battle Wyvern, Normal, Wrecker, Beast, Eyes of the Stone Thief,301
10, Blackscale Light-Killer, Normal, Archer, Humanoid, Bestiary 2,177
10, Borys Firesword, Normal, Troops, Humanoid, Eyes of the Stone Thief,294
10, Briar Elf Sorcerer, Normal, Caster, Humanoid, Bestiary 2,27
10, Bronze Kingsguard, Normal, Blocker, Construct, Bestiary 2,115
10, Drao Of The Ghostlands, Normal, Caster, Humanoid, Eyes of the Stone Thief,295
10, Dusk Zorigami, Normal, Wrecker, Construct, Bestiary,225
10, Efreet, Large, Wrecker, Giant, Bestiary,93
10, Elder Manafang Naga, Normal, Leader, Beast, Bestiary,145
10, Ethumel Self-Conceived, Normal, Spoiler, Giant, Eyes of the Stone Thief,347
10, Fire Ape, Normal, Wrecker, Beast, Eyes of the Stone Thief,346
10, Fomori Tyrant, Normal, Spoiler, Aberration, Bestiary 2,85
10, Frenzied Wolf Pack, Normal, Mook, Humanoid, Bestiary 2,92
10, Grandmother, Triple Strength, Caster, Humanoid, Bestiary 2,69
10, Great Fang Cadre (Orc), Normal, Mook, Humanoid, 13th Age Core Rulebook,242
10, Greater Summoned Ghoul, Normal, Mook, Undead, Bestiary 2,125
10, Gruesome Death Shade, Normal, Mook, Undead, Bestiary 2,231
